{"abi_version":2,"axis":"lexical","components":[{"component_ref":"partition_component_v2:94746eefeab57a3d630aca27","member_refs":["authentic_episode_v3:00cd56b88e7e56641736460f","authentic_episode_v3:01b126ca491909da46ba0c3b","authentic_episode_v3:01b7fe12ecba044ae093a9d5","authentic_episode_v3:0486adde65d048e933bc7b4b","authentic_episode_v3:059dbcaba31d14e3209edcb3","authentic_episode_v3:075abea2b6103898047c9813","authentic_episode_v3:08ec43d43a9bb288d4824f5f","authentic_episode_v3:090729805d79720431d1f855","authentic_episode_v3:093f532f7b3b71c8ce347143","authentic_episode_v3:0a4f8c103800f7705fce73f9","authentic_episode_v3:0a884a80f9763b593798faf7","authentic_episode_v3:0b3028f855f00d565ff8eba1","authentic_episode_v3:0b68e22487f1bacae74e7d54","authentic_episode_v3:0baf4a1506c0eb81bcd1f704","authentic_episode_v3:0bfede2e5e1b03f31d46588e","authentic_episode_v3:0c83909d4381c34a8ded7edc","authentic_episode_v3:0cd99acc365fb2b79e6a1e96","authentic_episode_v3:0e20805b41659861798b150f","authentic_episode_v3:0eb8427a02831eedf2d905c7","authentic_episode_v3:0ec19421b6542a290c3028bd","authentic_episode_v3:0eec17e0e3faedb45308ee11","authentic_episode_v3:0f62538ed3668dea0b1727f7","authentic_episode_v3:101a5a4a5ccef38f02a663e0","authentic_episode_v3:12827f314651bba54a55bdce","authentic_episode_v3:1345954a8c7250a6e185fa4d","authentic_episode_v3:139edd4ff122ad6171d28336","authentic_episode_v3:13f3e1536b978f081f239382","authentic_episode_v3:1419ed84698ff35c679c61e6","authentic_episode_v3:1590272b033d653bf796ab42","authentic_episode_v3:16352e377062703793f257eb","authentic_episode_v3:1640a689090f908673cbec87","authentic_episode_v3:164b7f0003d242c06c07ac82","authentic_episode_v3:16a0a73e546dfe68191e2854","authentic_episode_v3:186198890d2058adb0dea70d","authentic_episode_v3:1a6d83c3547dc80248dd00a7","authentic_episode_v3:1b04acd9025a9f1a02a16d2f","authentic_episode_v3:1c1488419ec0f6b705f96150","authentic_episode_v3:1c169b5aa1ad65c5c7076b71","authentic_episode_v3:1c64bb98d8f088deabf05b80","authentic_episode_v3:1c718ed57c8b15669e6b0fe5","authentic_episode_v3:1ce028c194ea054989992dbc","authentic_episode_v3:1d301e96fc9c779d81f0db82","authentic_episode_v3:1da11760774e2fefbc53ecff","authentic_episode_v3:1ecb3cb4423b576d64dd73f7","authentic_episode_v3:1ef450c5a1cc1d3f96a24365","authentic_episode_v3:1efeba88733ab4026775b375","authentic_episode_v3:1f2e0c98a891b7044194a1f9","authentic_episode_v3:1f7b4b39a52740659c1cf1d4","authentic_episode_v3:1fdd89e5d25e902a9b6f36f8","authentic_episode_v3:205018d6d8704e24430eec1f","authentic_episode_v3:20dcf38e1cc29ae2ac6dfc2e","authentic_episode_v3:22286c03d22dfee72b6d6ee9","authentic_episode_v3:22334e024e02c35ee28fb844","authentic_episode_v3:226ef6d746c0140293bd443d","authentic_episode_v3:2306d0922af9f3a58bed5918","authentic_episode_v3:234024ae7717c6108cf8db56","authentic_episode_v3:234f640ef27416992a61d713","authentic_episode_v3:23b4121b5e8f32739a350e40","authentic_episode_v3:2459e4e74e2178b2ff626fb9","authentic_episode_v3:2535bc2078bd047226cc5370","authentic_episode_v3:25b507aaeb31e0a1860d4a53","authentic_episode_v3:265be61d33323bac01575c3d","authentic_episode_v3:2716a56d14309b2c323519d2","authentic_episode_v3:27784f4708a2629056f04b31","authentic_episode_v3:288ae54380c99d6adcb683e8","authentic_episode_v3:2aaa8febea795c54b99b25a7","authentic_episode_v3:2ab0af0328bb5625fdc9cc03","authentic_episode_v3:2cfec48f2c29d9c20f85e8e7","authentic_episode_v3:2d72ffb89fb66d7be4d68066","authentic_episode_v3:2d801f15692c04d7ed5cdbda","authentic_episode_v3:2db0fd1b05c359584d26ca9d","authentic_episode_v3:2df0a94fb59ce4544a631b03","authentic_episode_v3:2fc472a28eb422b5d01ff3d6","authentic_episode_v3:2fe822f3a6d2522f34d7ccc0","authentic_episode_v3:302f1c9f624c675a7b173e38","authentic_episode_v3:30d7538c1d777abce7268ad4","authentic_episode_v3:310b44fbff56e873ca361ff6","authentic_episode_v3:316bcfc8c09e7e3b041473fd","authentic_episode_v3:317fbfd9f90f98a49c85f4f3","authentic_episode_v3:31c111db89f072aaefe214ae","authentic_episode_v3:31f6e2c40047876fac6d9757","authentic_episode_v3:324bce0f8c1858a9d0fca50e","authentic_episode_v3:328cd3f25f8415199f006df6","authentic_episode_v3:32903cb385fe90651c6c5a25","authentic_episode_v3:32b64eb6b7f54603948d7ebd","authentic_episode_v3:334e32e915eb73573e0f61f5","authentic_episode_v3:33b1002eaac25e05ce8b3ae3","authentic_episode_v3:33ea26df78a0a62e8f688296","authentic_episode_v3:33f2a65b6109cbfac01c584b","authentic_episode_v3:3456d548a816396c35d1fe98","authentic_episode_v3:3489b50337f85c3a621054cb","authentic_episode_v3:34ef0d8b8807c831bea12ddc","authentic_episode_v3:35c3d8992d233f7ef2550b68","authentic_episode_v3:36e02c0db3ee7c37d0532cea","authentic_episode_v3:380866166b441abb15e4d080","authentic_episode_v3:386520fd16023481195968d4","authentic_episode_v3:38d7436bcd18c540bac382a5","authentic_episode_v3:3984d09ad98be209f368d48d","authentic_episode_v3:39b9659c6f8e109b0cf55dce","authentic_episode_v3:3af598d499c192ed8b7f90ba","authentic_episode_v3:3b4239837d42d9578c434acc","authentic_episode_v3:3bda5b31b8e405de74964dbe","authentic_episode_v3:3c9c0ba18ffec9a4f4cf5ee9","authentic_episode_v3:3ca32df97abe38c43bc05e97","authentic_episode_v3:3cf25ab79f20d32a27eec40a","authentic_episode_v3:3e272f4c6640d87bb4219f1c","authentic_episode_v3:3e528dd7e22825ec210b8615","authentic_episode_v3:3e62ccf29926f5126a71f1f6","authentic_episode_v3:3e78804c9e57f990638bd90f","authentic_episode_v3:3f322c55385c9f64ae103646","authentic_episode_v3:3f4593633893a8dd620ce564","authentic_episode_v3:3fa191f6ee803ddcb3204852","authentic_episode_v3:406b69b7225f9ad3f92f5b38","authentic_episode_v3:40cb810241377dcdb0a5877a","authentic_episode_v3:410ad8478676abce036a8d94","authentic_episode_v3:41248a40f1fc9bdb0d2038e2","authentic_episode_v3:41f80bcab051efaeca4fd984","authentic_episode_v3:42aafbd5a008c0377595ded8","authentic_episode_v3:439fc4241cdfb95d122eefab","authentic_episode_v3:43a0911e84ece011c80a8f88","authentic_episode_v3:451077311c829a1eddc43f2e","authentic_episode_v3:45ff858bdff1eee8555f5a0c","authentic_episode_v3:476a65cecfbb95cff63aece3","authentic_episode_v3:477e7bec33058f97b8bcb9db","authentic_episode_v3:4821848cafdd15c6cb0a4ab1","authentic_episode_v3:4872b0e036c1a654b9b5580f","authentic_episode_v3:48d26b766b5a70dbafc335df","authentic_episode_v3:49882dd3ffae28ea6b76d23e","authentic_episode_v3:4a12d7c852dbed496fe9a5a6","authentic_episode_v3:4a9f664c28a9f2eec71efa12","authentic_episode_v3:4bee5bdea89ba6493d3900e7","authentic_episode_v3:4c19e6a51f29a952828b6d40","authentic_episode_v3:4d9c0ad5cc0dac06aad38ba1","authentic_episode_v3:4f1c950a6dc2c041e48cc253","authentic_episode_v3:4f380ba83fa4757273d5b986","authentic_episode_v3:50cf0d242cc9d31539916635","authentic_episode_v3:518bdc76f110a199e3e3d6de","authentic_episode_v3:52009017fcff3a04023225d9","authentic_episode_v3:527da8de38faa6ef5fed4f52","authentic_episode_v3:5309bf133830733153235488","authentic_episode_v3:53e00c5400a958070b4be2ab","authentic_episode_v3:546392c0502503e313b6ea5d","authentic_episode_v3:5495ed7009122e181a3b7630","authentic_episode_v3:54be4964e8177c6f98604eff","authentic_episode_v3:55397f3ae7cfe8dc5a524e22","authentic_episode_v3:555b43db8564f7e324d0e8e4","authentic_episode_v3:5567cefcc1bdcaa981b327cc","authentic_episode_v3:55771c48cd41e1c12de1623f","authentic_episode_v3:56685b38db12f208b9496027","authentic_episode_v3:572a77876ce6177fd42e768f","authentic_episode_v3:5752556849663b99c32adc7d","authentic_episode_v3:58b39a660a046f13a8261548","authentic_episode_v3:58b60c5a89e360abba457e14","authentic_episode_v3:5b25f7f248c8fa51fd2608b1","authentic_episode_v3:5c6d5d03cd2f6f115e08ff1d","authentic_episode_v3:5cf18f2bd4d312db217a79ee","authentic_episode_v3:5dc8f447d767cc0514ce02d5","authentic_episode_v3:5ed7fd423c8810461a44c92f","authentic_episode_v3:5f3a850e833d70034b92e3c7","authentic_episode_v3:5fac9bfcd3871a41d3592ac1","authentic_episode_v3:6087bc389e9c7a02a79026fa","authentic_episode_v3:60b00c7a12340a9b38af8276","authentic_episode_v3:60f1615dda25e1e753a9e196","authentic_episode_v3:60f44cca7c692701b2ce184c","authentic_episode_v3:61a34abbb5b81dc522ef02ab","authentic_episode_v3:626e0a032cbad7eb666f99ac","authentic_episode_v3:62a5bfd7c6f65036c3e3b4f9","authentic_episode_v3:63a864fe5669b695eaf9e5c8","authentic_episode_v3:641f4a86d90b1b8108c51b17","authentic_episode_v3:6467c1161cd9f740b2319830","authentic_episode_v3:660c449733a4716dd57cd9d7","authentic_episode_v3:688fdea3d636713e9a2b90ba","authentic_episode_v3:68f561110c05b65304721ace","authentic_episode_v3:6a0f7dff7e7396967247648e","authentic_episode_v3:6af7890290837a7f1f4ddf8d","authentic_episode_v3:6b20c4e11a5000d59930c86d","authentic_episode_v3:6b63df91f094ea1981eb474c","authentic_episode_v3:6bd9bc43f0b6fe1e3b258ff3","authentic_episode_v3:6c2100f00a122d0a3f12bf54","authentic_episode_v3:6cc9c22174cc160bb7d4361d","authentic_episode_v3:6d63dda2c9f90747e91f5c13","authentic_episode_v3:6e7dbaa3bcb395d9619b9468","authentic_episode_v3:7030825b32a215e34b28d6b8","authentic_episode_v3:706b5ad71cb5fa74a665dba1","authentic_episode_v3:7085ad61fe0d63763ede1cea","authentic_episode_v3:71b9c754553d43a86e69554c","authentic_episode_v3:7244ac4ec3f2ead90e72bd91","authentic_episode_v3:729e14930f7dd4823b71ac3b","authentic_episode_v3:72c5924e5d2418c3346b892f","authentic_episode_v3:73df61a50d4a2f1192a2bbb7","authentic_episode_v3:75382c298f6b7fd9c68ab49c","authentic_episode_v3:761cd7cbe878798d5dbfd542","authentic_episode_v3:76d860b7df6cf840ff53c829","authentic_episode_v3:7791fbc7813d7a39faff24ff","authentic_episode_v3:78bd8719bd11665ce89f64a2","authentic_episode_v3:78ff8478bcec88187c20de9a","authentic_episode_v3:79e3c8e0e899b53e88b60a92","authentic_episode_v3:7a0729fcb0c4e4b5dd4acc75","authentic_episode_v3:7a6e860bf96f5f3f7166d0c7","authentic_episode_v3:7a9420fe2f3c297733ba823c","authentic_episode_v3:7b2ab7939b623663ad33b213","authentic_episode_v3:7b4e983db05fd27b9a4da4ca","authentic_episode_v3:7b573f9245cca5184c45dd36","authentic_episode_v3:7bba8e4b6d580d9c3e574bb2","authentic_episode_v3:7cc27c5ecd5d3c2939f09945","authentic_episode_v3:7e2c2242